{
  "$schema": "../../schemas/contractlist.schema.json",
  "name": "Local Contracts",
  "timestamp": "2026-01-10T14:50:00Z",
  "version": {
    "major": 1,
    "minor": 0,
    "patch": 0
  },
  "contracts": [
    {
      "chainId": 1,
      "address": "0x111111125421cA6dc452d289314280a0f8842A65",
      "name": "1inch: Aggregation Router V6"
    }, {
      "chainId": 1,
      "address": "0xeDD53Bf3feFA7c481E9f5eFD3af56152db8016D8",
      "name": "User wallet"
    }
  ]
}